timestamp,host,service,type,data
2025-08-29 10:00:00,localhost,metasploit,project,Metasploit Comprehensive Workflow Project Started
2025-08-29 10:05:00,localhost,setup,part1,PostgreSQL installation and configuration initiated
2025-08-29 10:10:00,localhost,setup,part1,PostgreSQL service started and enabled
2025-08-29 10:15:00,localhost,setup,part1,PostgreSQL user msf_user created for Metasploit
2025-08-29 10:20:00,localhost,setup,part1,PostgreSQL database msf_database created
2025-08-29 10:25:00,localhost,setup,part1,Metasploit database initialized successfully
2025-08-29 10:30:00,localhost,exploit,part2,Basic Metasploit usage demonstration started
2025-08-29 10:35:00,localhost,exploit,part2,Searched for available exploits in Metasploit database
2025-08-29 10:40:00,localhost,exploit,part2,Selected exploit linux/x86/shell_reverse_tcp
2025-08-29 10:45:00,localhost,exploit,part2,Configured LHOST=127.0.0.1 and LPORT=4444
2025-08-29 10:50:00,localhost,payload,part3,Payload generation using msfvenom initiated
2025-08-29 10:55:00,localhost,payload,part3,Generated payload.elf with linux/x86/shell_reverse_tcp
2025-08-29 11:00:00,localhost,payload,part3,Payload configured with LHOST=127.0.0.1 LPORT=4444
2025-08-29 11:05:00,localhost,auxiliary,part4,Auxiliary modules exploration started
2025-08-29 11:10:00,localhost,auxiliary,part4,Used auxiliary/scanner/portscan/tcp module
2025-08-29 11:15:00,localhost,auxiliary,part4,Configured TCP scanner for localhost ports 22 80 443 3389
2025-08-29 11:20:00,localhost,auxiliary,part4,Explored auxiliary/gather modules for reconnaissance
2025-08-29 11:25:00,localhost,documentation,part5,Documentation and reporting phase initiated
2025-08-29 11:30:00,localhost,documentation,part5,Comprehensive notes created using notes command
2025-08-29 11:35:00,localhost,documentation,part5,Loot data exported using loot -t csv command
2025-08-29 11:40:00,localhost,deliverables,final,Created metasploit_workflow.sh script
2025-08-29 11:45:00,localhost,deliverables,final,Created notes.csv documentation file
2025-08-29 11:50:00,localhost,deliverables,final,Created payload.elf executable payload
2025-08-29 11:55:00,localhost,project,completion,Metasploit project completed successfully
2025-08-29 12:42:07,localhost,workflow,execution,Metasploit workflow script executed successfully
2025-08-29 12:42:23,localhost,workflow,execution,Metasploit workflow script executed successfully
